{"$schema":"https://json-schema.org/draft/2020-12/schema","$id":"figure-output-manifest.schema.json","type":"object","additionalProperties":false,"required":["schema_version","manifest_id","manifest_version","figure_id","figure_revision","figure_plan_ref","figure_plan_hash","figure_spec_ref","figure_spec_hash","canonical_output","svg_profile_ref","svg_profile_version","registry_ref","registry_version","used_feature_ids","capability_record_refs","fallback_decision","source_provenance_refs","style_resolution","privacy_state","output_lineage","static_critic","handoff_state"],"properties":{"schema_version":{"const":"1.0.0"},"manifest_id":{"type":"string"},"manifest_version":{"const":"1.0.0"},"figure_id":{"type":"string","pattern":"^FIG[0-9]{3}$"},"figure_revision":{"type":"string"},"figure_plan_ref":{"type":"string","pattern":"^FPL[0-9]{3}$"},"figure_plan_hash":{"type":"string","pattern":"^[a-f0-9]{64}$"},"figure_spec_ref":{"type":"string","pattern":"^FIG[0-9]{3}$"},"figure_spec_hash":{"type":"string","pattern":"^[a-f0-9]{64}$"},"canonical_output":{"type":"object","additionalProperties":false,"required":["kind","canonical_sha256","source_sha256","canonical_svg"],"properties":{"kind":{"const":"scientific_svg"},"canonical_sha256":{"type":"string","pattern":"^[a-f0-9]{64}$"},"source_sha256":{"type":"string","pattern":"^[a-f0-9]{64}$"},"canonical_svg":{"type":"string"}}},"svg_profile_ref":{"const":"SSVG-P001"},"svg_profile_version":{"const":"1.0.0"},"registry_ref":{"const":"SNCR001"},"registry_version":{"const":"1.0.0"},"used_feature_ids":{"type":"array","minItems":1,"items":{"type":"string"}},"capability_record_refs":{"type":"array","minItems":1,"items":{"type":"string"}},"fallback_decision":{"enum":["none","explicit_vector_fallback","explicit_raster_fallback"]},"source_provenance_refs":{"type":"object","additionalProperties":false,"required":["source_refs","claim_refs","evidence_refs"],"properties":{"source_refs":{"type":"array","items":{"type":"string"}},"claim_refs":{"type":"array","items":{"type":"string"}},"evidence_refs":{"type":"array","items":{"type":"string"}}}},"style_resolution":{"type":"object"},"privacy_state":{"type":"object","additionalProperties":false,"required":["private_alias_resolution_attempts","private_source_open_attempts","private_render_attempts"],"properties":{"private_alias_resolution_attempts":{"const":0},"private_source_open_attempts":{"const":0},"private_render_attempts":{"const":0}}},"output_lineage":{"type":"object"},"static_critic":{"type":"object"},"handoff_state":{"type":"string"}}}
