[
  {
    "schema_version": "1.0.0",
    "manifest_id": "FOM-FIG002-001",
    "manifest_version": "1.0.0",
    "figure_id": "FIG002",
    "figure_revision": "1",
    "figure_plan_ref": "FPL002",
    "figure_plan_hash": "5ae7353b19595db02f1ab737963095d3301bf68a9ef832d14beee2b2730fa69b",
    "figure_spec_ref": "FIG002",
    "figure_spec_hash": "37a73eac311e21117efc5fb97927bdb26280f45f423005ab547f31894b384526",
    "canonical_output": {
      "kind": "scientific_svg",
      "canonical_sha256": "38838b5feb9207543d317a6c94cc4bf4631bde0e2ff29f5450b06046e18a5f19",
      "source_sha256": "38838b5feb9207543d317a6c94cc4bf4631bde0e2ff29f5450b06046e18a5f19",
      "canonical_svg": "<?xml version=\"1.0\" encoding=\"UTF-8\"?><svg xmlns=\"http://www.w3.org/2000/svg\" data-thesis-figure-id=\"FIG002\" data-thesis-svg-version=\"1.0.0\" data-visual-class=\"fishbone_history\" viewBox=\"0 0 1600 900\"><defs><marker data-semantic-role=\"arrow\" id=\"obj-arrow\" markerHeight=\"8\" markerWidth=\"8\" orient=\"auto\" refX=\"7\" refY=\"4\"><path d=\"M 0 0 L 8 4 L 0 8 Z\" data-semantic-role=\"branch\" fill=\"#333333\" id=\"obj-arrow-path\"/></marker></defs><g data-semantic-role=\"container\" id=\"obj-frame\"><rect data-semantic-role=\"panel\" fill=\"#ffffff\" height=\"840\" id=\"obj-canvas\" stroke=\"#333333\" stroke-width=\"2\" width=\"1540\" x=\"30\" y=\"30\"/></g><text data-semantic-role=\"title\" font-family=\"Arial\" font-size=\"34\" font-weight=\"bold\" id=\"obj-title\" x=\"80\" y=\"95\">Fishbone / 研究地圖</text><line data-semantic-role=\"spine\" id=\"obj-spine\" marker-end=\"url(#obj-arrow)\" stroke=\"#333333\" stroke-width=\"5\" x1=\"180\" x2=\"1420\" y1=\"450\" y2=\"450\"/><rect data-semantic-role=\"node\" fill=\"#f4f4f4\" height=\"56\" id=\"obj-br001\" stroke=\"#333333\" stroke-width=\"2\" width=\"160\" x=\"180\" y=\"422\"/><line data-semantic-role=\"branch\" id=\"obj-edge-br002\" marker-end=\"url(#obj-arrow)\" stroke=\"#333333\" stroke-width=\"3\" x1=\"260\" x2=\"650\" y1=\"450\" y2=\"260\"/><rect data-semantic-role=\"node\" fill=\"#FF0000\" height=\"56\" id=\"obj-br002\" stroke=\"#333333\" stroke-width=\"2\" width=\"160\" x=\"570\" y=\"232\"/><line data-semantic-role=\"branch\" id=\"obj-edge-br003\" marker-end=\"url(#obj-arrow)\" stroke=\"#333333\" stroke-width=\"3\" x1=\"260\" x2=\"650\" y1=\"450\" y2=\"650\"/><rect data-semantic-role=\"node\" fill=\"#f4f4f4\" height=\"56\" id=\"obj-br003\" stroke=\"#333333\" stroke-width=\"2\" width=\"160\" x=\"570\" y=\"622\"/><line data-semantic-role=\"branch\" id=\"obj-edge-br004\" marker-end=\"url(#obj-arrow)\" stroke=\"#333333\" stroke-width=\"3\" x1=\"260\" x2=\"1040\" y1=\"450\" y2=\"260\"/><rect data-semantic-role=\"node\" fill=\"#f4f4f4\" height=\"56\" id=\"obj-br004\" stroke=\"#333333\" stroke-width=\"2\" width=\"160\" x=\"960\" y=\"232\"/><text data-semantic-role=\"label\" font-family=\"Arial\" font-size=\"18\" id=\"obj-label-br001\" x=\"195\" y=\"456\">Root [completed]</text><text data-semantic-role=\"label\" font-family=\"Arial\" font-size=\"18\" id=\"obj-label-br002\" x=\"585\" y=\"266\">Contact [partial]</text><text data-semantic-role=\"label\" font-family=\"Arial\" font-size=\"18\" id=\"obj-label-br003\" x=\"585\" y=\"656\">Future [future]</text><text data-semantic-role=\"label\" font-family=\"Arial\" font-size=\"18\" id=\"obj-label-br004\" x=\"975\" y=\"266\">Failed [failed]</text><text data-semantic-role=\"annotation\" font-family=\"Arial\" font-size=\"16\" id=\"obj-revision\" x=\"80\" y=\"835\">Revision FB001-R001 · current focus highlighted</text></svg>"
    },
    "svg_profile_ref": "SSVG-P001",
    "svg_profile_version": "1.0.0",
    "registry_ref": "SNCR001",
    "registry_version": "1.0.0",
    "used_feature_ids": [
      "font-attributes",
      "group",
      "line",
      "marker",
      "marker-local-reference",
      "path-commands",
      "rect",
      "stroke-width",
      "svg-root-viewbox",
      "text"
    ],
    "capability_record_refs": [
      "font-attributes",
      "group",
      "line",
      "marker",
      "marker-local-reference",
      "path-commands",
      "rect",
      "stroke-width",
      "svg-root-viewbox",
      "text"
    ],
    "fallback_decision": "none",
    "source_provenance_refs": {
      "source_refs": [
        "E101"
      ],
      "claim_refs": [
        "C101"
      ],
      "evidence_refs": [
        "E101"
      ]
    },
    "style_resolution": {
      "style_profile_ref": "VSP003",
      "required_categories": [
        "color_emphasis_grammar",
        "connector_arrow_grammar",
        "line_style_grammar"
      ],
      "token_provenance": [
        {
          "token_id": "style_color-04bee35503",
          "authority_family": "formal_shell",
          "token_family": "scientific_visual",
          "origin": "professor_derived",
          "evidence_tier": "single_example_provisional",
          "resolver_rule_id": "CP3-USAGE-BACKED-COLOR",
          "source_role": "P3-TEMPLATE-PRIMARY-3",
          "source_scope": "slide_master"
        },
        {
          "token_id": "style_color-04c6610b40",
          "authority_family": "body_composition",
          "token_family": "scientific_visual",
          "origin": "professor_derived",
          "evidence_tier": "recurring_pattern",
          "resolver_rule_id": "CP3-USAGE-BACKED-COLOR",
          "source_role": "P3-LAYOUT-EXEMPLAR-2",
          "source_scope": "slide_body"
        },
        {
          "token_id": "style_color-085181297b",
          "authority_family": "body_composition",
          "token_family": "scientific_visual",
          "origin": "professor_derived",
          "evidence_tier": "single_example_provisional",
          "resolver_rule_id": "CP3-USAGE-BACKED-COLOR",
          "source_role": "P3-LAYOUT-EXEMPLAR-2",
          "source_scope": "slide_body"
        },
        {
          "token_id": "style_color-2b6cf06b58",
          "authority_family": "body_composition",
          "token_family": "scientific_visual",
          "origin": "professor_derived",
          "evidence_tier": "single_example_provisional",
          "resolver_rule_id": "CP3-USAGE-BACKED-COLOR",
          "source_role": "P3-LAYOUT-EXEMPLAR-2",
          "source_scope": "slide_body"
        },
        {
          "token_id": "style_color-4f20e16624",
          "authority_family": "body_composition",
          "token_family": "scientific_visual",
          "origin": "professor_derived",
          "evidence_tier": "recurring_pattern",
          "resolver_rule_id": "CP3-USAGE-BACKED-COLOR",
          "source_role": "P3-LAYOUT-EXEMPLAR-2",
          "source_scope": "slide_body"
        },
        {
          "token_id": "style_color-66b316bca1",
          "authority_family": "body_composition",
          "token_family": "scientific_visual",
          "origin": "professor_derived",
          "evidence_tier": "recurring_pattern",
          "resolver_rule_id": "CP3-USAGE-BACKED-COLOR",
          "source_role": "P3-LAYOUT-EXEMPLAR-2",
          "source_scope": "slide_body"
        },
        {
          "token_id": "style_color-6fd94d2ef6",
          "authority_family": "formal_shell",
          "token_family": "scientific_visual",
          "origin": "professor_derived",
          "evidence_tier": "single_example_provisional",
          "resolver_rule_id": "CP3-USAGE-BACKED-COLOR",
          "source_role": "P3-TEMPLATE-PRIMARY-3",
          "source_scope": "slide_master"
        },
        {
          "token_id": "style_color-71dad4de15",
          "authority_family": "formal_shell",
          "token_family": "scientific_visual",
          "origin": "professor_derived",
          "evidence_tier": "single_example_provisional",
          "resolver_rule_id": "CP3-USAGE-BACKED-COLOR",
          "source_role": "P3-TEMPLATE-PRIMARY-1",
          "source_scope": "slide_master"
        },
        {
          "token_id": "style_color-7602cae5f2",
          "authority_family": "formal_shell",
          "token_family": "scientific_visual",
          "origin": "professor_derived",
          "evidence_tier": "single_example_provisional",
          "resolver_rule_id": "CP3-USAGE-BACKED-COLOR",
          "source_role": "P3-TEMPLATE-PRIMARY-1",
          "source_scope": "slide_layout"
        },
        {
          "token_id": "style_color-91e01b86ac",
          "authority_family": "body_composition",
          "token_family": "scientific_visual",
          "origin": "professor_derived",
          "evidence_tier": "recurring_pattern",
          "resolver_rule_id": "CP3-USAGE-BACKED-COLOR",
          "source_role": "P3-LAYOUT-EXEMPLAR-2",
          "source_scope": "slide_body"
        },
        {
          "token_id": "style_color-937c64c5f6",
          "authority_family": "formal_shell",
          "token_family": "scientific_visual",
          "origin": "professor_derived",
          "evidence_tier": "single_example_provisional",
          "resolver_rule_id": "CP3-USAGE-BACKED-COLOR",
          "source_role": "P3-TEMPLATE-PRIMARY-1",
          "source_scope": "slide_layout"
        },
        {
          "token_id": "style_color-a0fc4cbe15",
          "authority_family": "formal_shell",
          "token_family": "scientific_visual",
          "origin": "professor_derived",
          "evidence_tier": "single_example_provisional",
          "resolver_rule_id": "CP3-USAGE-BACKED-COLOR",
          "source_role": "P3-TEMPLATE-PRIMARY-3",
          "source_scope": "slide_layout"
        },
        {
          "token_id": "style_color-ad01ea9da5",
          "authority_family": "body_composition",
          "token_family": "scientific_visual",
          "origin": "professor_derived",
          "evidence_tier": "recurring_pattern",
          "resolver_rule_id": "CP3-USAGE-BACKED-COLOR",
          "source_role": "P3-LAYOUT-EXEMPLAR-2",
          "source_scope": "slide_body"
        },
        {
          "token_id": "style_color-d93ab974ea",
          "authority_family": "formal_shell",